{
  "$schema": "../../schema.json",
  "cloud": "gcp",
  "service": "security/secret-manager",
  "console_path": "/security/secret-manager",
  "status": "reviewed",
  "captured_at": "2026-10-30",
  "nav": [
    {
      "label": "Secret Manager",
      "page_id": "secrets"
    }
  ],
  "pages": [
    {
      "id": "secrets",
      "kind": "list",
      "title": "Secret Manager",
      "route": "/security/secret-manager",
      "provenance": "reference",
      "confidence": "medium",
      "notes": "Capture of /security/secret-manager/create shows the 'Enable Secret Manager API' page.",
      "captures": [
        "C-forms/10-security-secret-manager-create/step-1"
      ],
      "header_actions": [
        "Create secret",
        "Delete",
        "Refresh"
      ],
      "tabs": [
        "Secrets",
        "Regional secrets"
      ],
      "table": {
        "selection": "multi",
        "actions": [
          "View secret details",
          "Add new version",
          "Edit secret",
          "Delete"
        ],
        "filter_placeholder": "Filter",
        "pagination": true,
        "confidence": "medium",
        "columns": [
          "Name",
          "Location",
          "Encryption",
          "Labels",
          "Created",
          "Expiration",
          "Actions"
        ]
      }
    },
    {
      "id": "create-secret",
      "kind": "create",
      "title": "Create secret",
      "route": "/security/secret-manager/create",
      "captures": [
        "C-forms/10-security-secret-manager-create/step-1"
      ],
      "provenance": "reference",
      "confidence": "medium",
      "submit": "Create secret",
      "sections": [
        {
          "title": "Secret details",
          "fields": [
            {
              "label": "Name",
              "type": "text",
              "required": true
            },
            {
              "label": "Upload file",
              "type": "file",
              "actions": [
                "Browse"
              ]
            },
            {
              "label": "Secret value",
              "type": "textarea"
            }
          ]
        },
        {
          "title": "Replication policy",
          "fields": [
            {
              "label": "Automatically manage locations for this secret",
              "type": "checkbox",
              "default": true
            },
            {
              "label": "Locations",
              "type": "select"
            }
          ]
        },
        {
          "title": "Encryption",
          "fields": [
            {
              "label": "Encryption",
              "type": "radio",
              "default": "Google-managed encryption key",
              "options": [
                "Google-managed encryption key",
                "Customer-managed encryption key (CMEK)"
              ]
            }
          ]
        },
        {
          "title": "Rotation",
          "fields": [
            {
              "label": "Set rotation period",
              "type": "checkbox",
              "default": false
            }
          ]
        },
        {
          "title": "Notifications",
          "fields": [
            {
              "label": "Add topic",
              "type": "button"
            }
          ]
        },
        {
          "title": "Expiration",
          "fields": [
            {
              "label": "Set expiration date",
              "type": "checkbox",
              "default": false
            }
          ]
        },
        {
          "title": "Labels",
          "fields": [
            {
              "label": "Labels",
              "type": "tags",
              "actions": [
                "Add label"
              ]
            }
          ]
        },
        {
          "title": "Annotations",
          "fields": [
            {
              "label": "Annotations",
              "type": "tags",
              "actions": [
                "Add annotation"
              ]
            }
          ],
          "confidence": "low"
        },
        {
          "title": "Version aliases",
          "fields": [
            {
              "label": "Version aliases",
              "type": "tags",
              "actions": [
                "Add alias"
              ]
            }
          ],
          "confidence": "low"
        }
      ]
    },
    {
      "id": "secret-details",
      "kind": "detail",
      "title": "{resource-name}",
      "route": "/security/secret-manager/secret/{resource-name}/versions",
      "breadcrumbs": [
        "Secret Manager",
        "{resource-name}"
      ],
      "provenance": "reference",
      "confidence": "medium",
      "header_actions": [
        "Edit secret",
        "Delete"
      ],
      "tabs": [
        "Overview",
        "Versions",
        "Permissions",
        "Logs"
      ],
      "tab_panels": [
        {
          "label": "Versions",
          "sections": [
            {
              "title": "Versions",
              "table": {
                "header_actions": [
                  "New version",
                  "Enable",
                  "Disable",
                  "Destroy"
                ],
                "actions": [
                  "View secret value",
                  "Disable",
                  "Enable",
                  "Destroy"
                ],
                "columns": [
                  "Version",
                  "Status",
                  "Created",
                  "Location",
                  "Encryption",
                  "Actions"
                ]
              }
            }
          ]
        },
        {
          "label": "Overview",
          "sections": [
            {
              "title": "Secret details",
              "fields": [
                {
                  "label": "Resource ID",
                  "type": "readonly"
                },
                {
                  "label": "Replication policy",
                  "type": "readonly"
                },
                {
                  "label": "Encryption",
                  "type": "readonly"
                },
                {
                  "label": "Rotation",
                  "type": "readonly"
                },
                {
                  "label": "Expiration",
                  "type": "readonly"
                },
                {
                  "label": "Labels",
                  "type": "readonly"
                },
                {
                  "label": "Created",
                  "type": "readonly"
                }
              ]
            }
          ]
        }
      ]
    },
    {
      "id": "add-version",
      "kind": "create",
      "title": "Add new version",
      "provenance": "reference",
      "confidence": "medium",
      "submit": "Add new version",
      "sections": [
        {
          "title": "Version",
          "fields": [
            {
              "label": "Secret value",
              "type": "textarea",
              "required": true
            },
            {
              "label": "Upload file",
              "type": "file"
            },
            {
              "label": "Disable all past versions",
              "type": "checkbox",
              "default": false
            }
          ]
        }
      ]
    }
  ],
  "gaps_note": "Create form capture shows the 'Enable Secret Manager API' page; all labels are reference (current console)."
}
