{
  "$schema": "../schema.json",
  "cloud": "aws",
  "service": "secretsmanager",
  "console_path": "/secretsmanager/",
  "status": "draft",
  "nav": [
    {
      "label": "AWS Secrets Manager",
      "page_id": "aws-secrets-manager"
    },
    {
      "label": "Secrets",
      "page_id": "secrets"
    }
  ],
  "pages": [
    {
      "id": "landing",
      "kind": "other",
      "title": "Secrets Manager",
      "route": "/secretsmanager/home",
      "captures": [
        "A-secretsmanager/001-L1-landing"
      ],
      "provenance": "capture"
    },
    {
      "id": "aws-secrets-manager",
      "kind": "other",
      "title": "Secrets Manager",
      "route": "/secretsmanager/home",
      "captures": [
        "A-secretsmanager/002-L2-aws-secrets-manager"
      ],
      "provenance": "capture"
    },
    {
      "id": "secrets",
      "kind": "list",
      "title": "Secrets",
      "route": "/secretsmanager/listsecrets",
      "breadcrumbs": [
        "AWS Secrets Manager",
        "Secrets"
      ],
      "captures": [
        "A-secretsmanager/003-L2-secrets"
      ],
      "provenance": "capture",
      "table": {
        "resource_label": "Store a new secret",
        "columns": [
          "Secret name",
          "Description",
          "Last retrieved (UTC)",
          "Created on (UTC)"
        ],
        "header_actions": [],
        "confidence": "low"
      }
    },
    {
      "id": "newsecret",
      "kind": "create",
      "title": "Store a new secret",
      "route": "/secretsmanager/newsecret",
      "breadcrumbs": [
        "AWS Secrets Manager",
        "Secrets",
        "Store a new secret"
      ],
      "captures": [
        "C-secretsmanager/01-newsecret/step-1",
        "C-secretsmanager/01-newsecret/step-1-expanded",
        "C-secretsmanager/01-newsecret/step-2",
        "C-secretsmanager/01-newsecret/step-3"
      ],
      "provenance": "capture",
      "table": {
        "columns": [
          "DB instance",
          "DB engine",
          "Status",
          "Creation date (UTC)"
        ],
        "header_actions": [],
        "confidence": "low"
      },
      "steps": [
        {
          "title": "Choose secret type",
          "optional": false,
          "sections": [
            {
              "title": "(form)",
              "fields": [
                {
                  "label": "Step 3",
                  "type": "radio",
                  "options": [
                    "Configure rotation",
                    "Step 4",
                    "Review",
                    "Choose secret type"
                  ],
                  "default": "Configure rotation",
                  "required": false,
                  "confidence": "low"
                }
              ]
            },
            {
              "title": "Secret type",
              "fields": [
                {
                  "label": "Managed external secret",
                  "type": "select",
                  "default": "Other type of secret",
                  "required": true,
                  "help": "Secrets vended by your third-party software vendor.",
                  "confidence": "low"
                }
              ]
            }
          ]
        },
        {
          "title": "Configure secret",
          "optional": false
        },
        {
          "title": "Configure rotation",
          "optional": true
        },
        {
          "title": "Review",
          "optional": false
        }
      ]
    }
  ],
  "gaps_note": "Auto-extracted draft from text captures; field types, sections and option lists are heuristic (confidence: low). Review against screenshots before use."
}
